{
  "$schema": "../schemas/component.schema.json",
  "id": "skeleton",
  "name": "Skeleton Loader",
  "version": "0.3.0",
  "category": "state",
  "description": "500ms 이상의 로딩 동안 실제 콘텐츠의 그림자를 미리 보여줌. shimmer 애니메이션으로 '곧 채워진다'는 신호.",
  "variants": [
    { "id": "text-line",  "label": "Text Line",   "html": "<div class=\"skeleton skeleton-text\"></div>" },
    { "id": "avatar",     "label": "Avatar",      "html": "<div class=\"skeleton skeleton-avatar\"></div>" },
    { "id": "thumbnail",  "label": "Thumbnail",   "html": "<div class=\"skeleton skeleton-thumb\"></div>" },
    { "id": "card",       "label": "Card",        "description": "카드 전체 (avatar + 2 lines + thumb)", "html": "<div class=\"skeleton-card\">...</div>" },
    { "id": "list-row",   "label": "List Row",    "description": "leading + title + sub" }
  ],
  "states": ["loading"],
  "tokens": {
    "bg":       "--sm-background-muted",
    "shimmer":  "linear-gradient(90deg, transparent, rgba(255,255,255,0.45), transparent)",
    "radius":   "--radius-sm (text), 50% (avatar)",
    "duration": "1.4s",
    "easing":   "ease-in-out infinite"
  },
  "accessibility": {
    "role": "status",
    "ariaNotes": [
      "부모 컨테이너에 aria-busy=true, aria-live=polite",
      "스크린리더에 '로딩 중' 텍스트 제공 (시각 숨김)",
      "prefers-reduced-motion 시 shimmer 애니메이션 제거"
    ]
  },
  "whenToUse": ["500ms 이상 예상되는 로딩", "레이아웃 시프트 방지"],
  "whenNotToUse": [
    "500ms 미만 → 아무것도 표시하지 않음",
    "이미 데이터가 있을 때 refresh → 리프레시 인디케이터만",
    "에러 상태 → Empty State"
  ],
  "uxWriting": ["텍스트 없음 (시각적 신호만)"],
  "usedInDemos": [],
  "relatedDocs": { "md": "components/skeleton-loader.md", "sourceHtml": "index.html#skeleton" }
}
